,,"Name (click to view profile)",Date,Likes,isHearted,isPinned,Comment,"Profile ID","Comment ID","Comment URL"
1,,@louise-u6u,"2024-08-19 14:12:34",0,no,no,"This movie, which uses radio soundtracks and old commercials, takes me back to that summer of 1969. Even though I did not live in California, those commercials, especially the ""Heaven Scent"" cologne one, was familiar to me even in the Midwest listening to WIXY 1260 AM radio, Cleveland, Ohio. The scenes where Cliff gets out of Spahn with the radio giving the time right  before Tex comes back and the one where the radio sinks in Rick's pool while still going for a few seconds just cracked me up. Amazing movie and cannot forget the amazing Brandy....and the amazing, albeit tragic, summer of 1969. This was a brilliantly and seamlessly crafted film.",UCuNY6eokhgF4Dj7fvQ36Q9w,UgynarFw5kFZrvWx_yZ4AaABAg,https://www.youtube.com/watch?v=ELeMaP8EPAA&lc=UgynarFw5kFZrvWx_yZ4AaABAg
2,,@EvelineCornelia,"2024-08-21 09:42:11",0,no,no,"Lewis Scott Moore Paul Thompson Christopher",UC9zE7F5dEGGuGCaSbJcKqvw,UgyvrUXZNq5Q0t-5EFZ4AaABAg,https://www.youtube.com/watch?v=ELeMaP8EPAA&lc=UgyvrUXZNq5Q0t-5EFZ4AaABAg
3,,@jwilham,"2024-08-28 06:18:23",0,no,no,"this show made me hate hippies. woke colored hair losers are just modern day hippies.
PS. movie sucks. entire movie for just one scene at the end. and even that is stupid. girl burns in a pool filled with water.",UC0TNJoHosmJnXWzcRNMS7tg,UgzG-e2YtAPzrMU8wvV4AaABAg,https://www.youtube.com/watch?v=ELeMaP8EPAA&lc=UgzG-e2YtAPzrMU8wvV4AaABAg
4,,@mozamelahmadi5648,"2024-09-09 00:52:41",1,no,no,"Extinction c?",UCRg4N210vU3p1u8OM8n9NsQ,UgwdpgnjdE3IsccGeON4AaABAg,https://www.youtube.com/watch?v=ELeMaP8EPAA&lc=UgwdpgnjdE3IsccGeON4AaABAg
5,,@HobertKhou-x6n,"2024-09-12 16:28:51",0,no,no,"Ritchie Flat",UCOb-DxT6G-K1WqcYk6d1m4g,UgypVYioAf5wzNKKmxV4AaABAg,https://www.youtube.com/watch?v=ELeMaP8EPAA&lc=UgypVYioAf5wzNKKmxV4AaABAg
6,,@MontyDozer-h7i,"2024-09-14 00:08:22",0,no,no,"Darron Summit",UC8oPtLnnnT48jI9ZW0Qlz9A,UgwgtVtUw_aHdwdrBKd4AaABAg,https://www.youtube.com/watch?v=ELeMaP8EPAA&lc=UgwgtVtUw_aHdwdrBKd4AaABAg
7,,@claire1254,"2024-09-15 15:16:01",0,no,no,"´´Is that your son?´´😂",UCfWTwLT_lVxl2ww2Y75hk0A,UgzinOdEml4DsvWFAcZ4AaABAg,https://www.youtube.com/watch?v=ELeMaP8EPAA&lc=UgzinOdEml4DsvWFAcZ4AaABAg
8,,@streaming-c7p,"2024-09-16 12:55:03",0,no,no,"great movie👍",UC8B5ap9f8ja_7jm3YWf0xSw,UgxTVF1OclAM2Bi48o94AaABAg,https://www.youtube.com/watch?v=ELeMaP8EPAA&lc=UgxTVF1OclAM2Bi48o94AaABAg
9,,@flips300021,"2024-09-17 14:57:29",0,no,no,"Arguably, for some. The best flick Tarantino has ever made. I hate to laugh during watching, but I did. I always think I'm going to miss the biggest. The Bruce Lee scene is especially funny. And Damian Lewis as Steve McQueen is just genius ! This flick is pure diamond. A real treat. Don't hesitate. Watch this masterpiece. Brandy! Who's a good dog!!! Ruffle, Ruffle...and remember, kids. To smoke Red Apple cigarettes or The LSD dipped kind ❤",UCLrraQX90-MrOZtnsZ3FjwA,UgxTEFs01WUnESoNDVl4AaABAg,https://www.youtube.com/watch?v=ELeMaP8EPAA&lc=UgxTEFs01WUnESoNDVl4AaABAg
10,,@MrGabeanator,"2024-09-25 03:56:01",0,no,no,awesome,UCFy_J-_SNDTg17_YaiD9Aow,UgwLqtuoPN0oIKaomNx4AaABAg,https://www.youtube.com/watch?v=ELeMaP8EPAA&lc=UgwLqtuoPN0oIKaomNx4AaABAg
11,,@FreedomCinema88,"2024-09-26 08:14:59",0,no,no,"2019 movies feel like they are from a different era already, this one especially. It has aged so well (something i can't say for other 2019 movies). After Covid, cinema just doesn't feel the same anymore. Anyone else feel like that sometimes?",UCdcKNqck4tsxnN2Wb8C1EGw,UgxCsjyjvfATmZ9V-314AaABAg,https://www.youtube.com/watch?v=ELeMaP8EPAA&lc=UgxCsjyjvfATmZ9V-314AaABAg
12,,@Rufaaci-s9f,"2024-09-27 16:44:42",1,no,no,"I don't know why but this movie was completely boring an felt like it had no story",UCQJUXAEY1JU0CuGt49UiCtA,Ugwrq6QtPE7-RiB9uPp4AaABAg,https://www.youtube.com/watch?v=ELeMaP8EPAA&lc=Ugwrq6QtPE7-RiB9uPp4AaABAg
13,,@evangelineriches,"2024-09-28 04:32:08",0,no,no,"I like paramount maybe send me cash money. 😅💰",UCErRfJPfM_ukYPiL1bnyaqw,UgzDZXk5geO_oR_96jZ4AaABAg,https://www.youtube.com/watch?v=ELeMaP8EPAA&lc=UgzDZXk5geO_oR_96jZ4AaABAg
14,,@RobertoSeraj-dm5sb,"2024-09-30 13:47:07",1,no,no,"Tarantino legends 🎉🎉🎉🎉",UCTt0xyRmTVyzCsQmOAMj_1w,Ugy54sRq7h1MEv90ke54AaABAg,https://www.youtube.com/watch?v=ELeMaP8EPAA&lc=Ugy54sRq7h1MEv90ke54AaABAg
15,,@kasiebracewell4121,"2024-10-02 22:13:44",0,no,no,"I watched this for Austin Butler. Glad I did tho. It was a good movie",UCueRq08ZfpzMOvPR4-NdmsA,UgzqMfwrqmCQSifpmBl4AaABAg,https://www.youtube.com/watch?v=ELeMaP8EPAA&lc=UgzqMfwrqmCQSifpmBl4AaABAg
16,,@lotto1471,"2024-10-03 05:06:58",0,no,no,"I dont know how people consider this a great film. Easily one of the dumbest movies ive watched",UCBV0qrYG63d957CQeqq5pOw,UgxKmepTjuSzk-iV2TN4AaABAg,https://www.youtube.com/watch?v=ELeMaP8EPAA&lc=UgxKmepTjuSzk-iV2TN4AaABAg
17,,@TonyMichaels166,"2024-10-05 16:57:53",3,no,no,"Seeing this film in a theater full of older people who remember and were present in the time its set added a whole new element to the viewing experience. They were all hooting and whooping during the final scene.",UCreHRwTi9lo1wdoSUu1A0GQ,UgxXDNLxzmozYRFPAzt4AaABAg,https://www.youtube.com/watch?v=ELeMaP8EPAA&lc=UgxXDNLxzmozYRFPAzt4AaABAg
18,,@AdrianScottty,"2024-10-12 03:02:30",0,no,no,"Lewis Kimberly Lewis Cynthia Harris Matthew",UCyabjfqOFhHtbdbeHzmv8Rg,UgyipyLHVsOhaGvczxp4AaABAg,https://www.youtube.com/watch?v=ELeMaP8EPAA&lc=UgyipyLHVsOhaGvczxp4AaABAg
19,,@josemedeiros007,"2024-10-15 00:45:40",4,no,no,"Great movie, I was lucky enough to see it for free at an advance screening at AMC Saratoga theaters before it was released to the public.",UCPG78qqw3UDf6xwM4b3f9Ew,Ugyx0YmLIG1lG8iXC5N4AaABAg,https://www.youtube.com/watch?v=ELeMaP8EPAA&lc=Ugyx0YmLIG1lG8iXC5N4AaABAg
20,,@josephkunath4173,"2024-10-16 16:24:04",1,no,no,"Fantastic movie",UCFSFYYZZ_PGSukVwdq3zuhw,Ugy9aCP1tu0acgA17M94AaABAg,https://www.youtube.com/watch?v=ELeMaP8EPAA&lc=Ugy9aCP1tu0acgA17M94AaABAg
21,,@ANFattahShafy-jj4sk,"2024-10-18 13:10:15",2,no,no,"Alpacino thinks leonerdo(49) is brad pitts(60) father. Really😂😂😂",UCTeAUu-sHUJN6J3-VQjGv6Q,UgyGVcydfk3mqLo0J_Z4AaABAg,https://www.youtube.com/watch?v=ELeMaP8EPAA&lc=UgyGVcydfk3mqLo0J_Z4AaABAg
22,,@nilam5658,"2024-10-19 09:32:19",0,no,no,"Waste of time",UCnYkiVhOJ8-h-lLyADnachg,Ugyu-SADEpicMAnpDbJ4AaABAg,https://www.youtube.com/watch?v=ELeMaP8EPAA&lc=Ugyu-SADEpicMAnpDbJ4AaABAg
23,,@radioactive.rabbit,"2024-10-21 20:55:34",1,no,no,"So interested, in which shady rings and ""relationships"" Leo is in. White nights at p Diddy huh",UC_Z46teE-wEriCpd6RFlK_Q,UgwZxtD0ssRN1XokCxh4AaABAg,https://www.youtube.com/watch?v=ELeMaP8EPAA&lc=UgwZxtD0ssRN1XokCxh4AaABAg
24,,@TheDisruptiveOne,"2024-10-22 04:22:15",1,no,no,"some of the secondary actors in this movie have become pretty big stars in their own right",UC-L2rXGJ93hpG-WKhKwDVuA,UgyBDXnL4G1e7UHz_lJ4AaABAg,https://www.youtube.com/watch?v=ELeMaP8EPAA&lc=UgyBDXnL4G1e7UHz_lJ4AaABAg
25,,@kshitijhargude5201,"2024-10-25 15:44:46",2,no,no,"This movie has One of the best cast Ever",UC7vl3RZhChQcMnihNOzB8mA,Ugxe_1E2iZLOEZcklap4AaABAg,https://www.youtube.com/watch?v=ELeMaP8EPAA&lc=Ugxe_1E2iZLOEZcklap4AaABAg
26,,@muffassa6739,"2024-10-26 08:48:09",1,no,no,"A great masterpiece 👏 with how we wished it to happen the killer's not killing anyone that night but getting killed .perfect cast 👌 a great movie and I've watched it many times 👌 👍 😀",UCJo2_qdJHPXMj0VEb3THhqA,UgyQ5cmuBBPP8QT2pvV4AaABAg,https://www.youtube.com/watch?v=ELeMaP8EPAA&lc=UgyQ5cmuBBPP8QT2pvV4AaABAg
27,,@timluke8933,"2024-10-30 07:37:58",0,no,no,"rock spider",UCxr-Z3CGbeeIhpC2rc8ZFzg,UgyE-xAUuU91zjlCUVd4AaABAg,https://www.youtube.com/watch?v=ELeMaP8EPAA&lc=UgyE-xAUuU91zjlCUVd4AaABAg
28,,@DiCaprioMOVIE,"2024-10-30 20:58:50",5,no,no,"underrated film unfortunately.😢",UChwottke0X_fKeLx9rAYAHw,UgwIhF9kpOlmNThmIeh4AaABAg,https://www.youtube.com/watch?v=ELeMaP8EPAA&lc=UgwIhF9kpOlmNThmIeh4AaABAg
29,,@Chemwarrior319,"2024-11-02 01:49:10",0,no,no,"Once upon a time in Hollywood best thing ever happened to me in life ❤",UCVGlWEi9sVJsdplrucx7Jvg,UgwzXMgcQmjPbYMbEvd4AaABAg,https://www.youtube.com/watch?v=ELeMaP8EPAA&lc=UgwzXMgcQmjPbYMbEvd4AaABAg
30,,@ryanmartin407,"2024-11-06 15:26:06",0,no,no,"Once upon a time in hollywood",UCmLqOTpzsiaeJPBhRBCLN_g,UgycHoyxqjl0Flu7hcN4AaABAg,https://www.youtube.com/watch?v=ELeMaP8EPAA&lc=UgycHoyxqjl0Flu7hcN4AaABAg
31,,@TYMOEnglishforKids,"2024-11-10 14:35:26",0,no,no,"the most unbelievable part is Leo forgot how to act in the movie",UCTfvy53tLhB-E9khaOmXuSg,UgzCLT6u-yMypP_be1d4AaABAg,https://www.youtube.com/watch?v=ELeMaP8EPAA&lc=UgzCLT6u-yMypP_be1d4AaABAg
32,,@urbanjunglednbbreakcorehhc6781,"2024-11-12 06:49:44",1,no,no,"What do you think about 13-14 year olds being legal in Europe and Americans are dating ugly old ladies? ?",UCHQMIsLVyMWDOOk0KqLmhzA,UgyR1tCa8uNB06B2Axx4AaABAg,https://www.youtube.com/watch?v=ELeMaP8EPAA&lc=UgyR1tCa8uNB06B2Axx4AaABAg
33,,@kennethsnider3456,"2024-11-20 23:22:56",0,no,no,"I just today found out that Tex was played by Austin Butler.",UCIEkQqaNzEgUromufqQxVIw,UgycDy3jrFCBSaVlvAB4AaABAg,https://www.youtube.com/watch?v=ELeMaP8EPAA&lc=UgycDy3jrFCBSaVlvAB4AaABAg
34,,@ValerieEhrlich-h1i,"2024-11-24 04:06:22",0,no,no,"Using music by Neil Diamond and Paul Revere and The Raiders.......THANK YOU",UCozwRgA5jumSy8nHL8jMqkw,Ugy6uehel0v9vjIUwpZ4AaABAg,https://www.youtube.com/watch?v=ELeMaP8EPAA&lc=Ugy6uehel0v9vjIUwpZ4AaABAg
35,,@hognuckles,"2024-11-25 09:25:03",4,no,no,"I am a huge Tarantino fan. This is my first time watching once upon a Time in hollywood, I am 1 hour in and and this has to be the most boring movie I have ever spent an hour of my life watching. Leonard part 6 was better in the first hour.",UCxs2YyIbm8faXcPS8mw8ARQ,UgxewNAWYbIu_4HIJFF4AaABAg,https://www.youtube.com/watch?v=ELeMaP8EPAA&lc=UgxewNAWYbIu_4HIJFF4AaABAg
36,,@ilyesbenamar4578,"2024-12-16 21:12:45",1,no,no,"They made a nostalgic trailer the day they released it😂😂❤❤",UCtWXj0FantHwaS0w6vEluTQ,Ugzs0FAUoImJU8W-cI94AaABAg,https://www.youtube.com/watch?v=ELeMaP8EPAA&lc=Ugzs0FAUoImJU8W-cI94AaABAg
37,,@vernhalvorson7326,"2024-12-18 03:50:54",2,no,no,"Good movie.   For a minute I thought it was a true story for a bit.   So had to look that up.    Now I could only wish the ending could have been true.",UC8CrzksODrPj_BBOK-bvvdw,UgzJNKXbooVPUIM8UQJ4AaABAg,https://www.youtube.com/watch?v=ELeMaP8EPAA&lc=UgzJNKXbooVPUIM8UQJ4AaABAg
38,,@Bearguy7700,"2024-12-18 09:20:44",2,no,no,"This movie is 5 years old 😐 time flies",UCk6sRdtjXKMVZ5fGwg7_ZQg,UgyuU3sXadjehztYohB4AaABAg,https://www.youtube.com/watch?v=ELeMaP8EPAA&lc=UgyuU3sXadjehztYohB4AaABAg
39,,@Cragar-i7q,"2024-12-24 01:41:36",0,no,no,"n then they stroked each other off at hollywood cars n coffee",UCV8LEWrV5P0wgl1ZKW-ZleA,UgyCUMkMqjY54Sx4TNl4AaABAg,https://www.youtube.com/watch?v=ELeMaP8EPAA&lc=UgyCUMkMqjY54Sx4TNl4AaABAg
40,,@24mmfilm40,"2024-12-24 19:10:46",0,no,no,"Quinten is getting old. He started to remember the old age",UCm7bOwFhB1iO0KOn1YRLJyA,UgzzgjUMcYSH1SP9RMh4AaABAg,https://www.youtube.com/watch?v=ELeMaP8EPAA&lc=UgzzgjUMcYSH1SP9RMh4AaABAg
41,,@thec.e.oofbasedindustries8013,"2025-01-05 14:38:18",2,no,no,"The entire aesthetic of this movie is what I think the 60s looks like",UC_Mwt_bDh19UKACc0vQuLlQ,UgwgMo8iSmp-zLl5kDx4AaABAg,https://www.youtube.com/watch?v=ELeMaP8EPAA&lc=UgwgMo8iSmp-zLl5kDx4AaABAg
42,,@anonaki-mt6xb,"2025-01-06 19:41:56",1,no,no,"Leonardo DiCaprio, World Economic Forum member and Globalist stooge.",UC5FLxdVeB6muWlxA__FSuFQ,Ugw2Ne3GaIsezr1FzTp4AaABAg,https://www.youtube.com/watch?v=ELeMaP8EPAA&lc=Ugw2Ne3GaIsezr1FzTp4AaABAg
43,,@AnhTuPhucDerrickHoangCanada,"2025-01-07 20:22:19",1,no,no,"Cults of the Elite",UCybBtaY1Ib84aie9mGKZTlw,UgxaSImptnANdHNoo994AaABAg,https://www.youtube.com/watch?v=ELeMaP8EPAA&lc=UgxaSImptnANdHNoo994AaABAg
44,,@mattgehringer7292,"2025-01-11 19:22:19",0,no,no,"Excellent soundtrack!",UCUfjxpns4WZxJfCsCWqBvVQ,UgyzkE9UDewVd20_iAx4AaABAg,https://www.youtube.com/watch?v=ELeMaP8EPAA&lc=UgyzkE9UDewVd20_iAx4AaABAg
45,,@wallymoon666,"2025-01-13 23:00:18",0,no,no,"When the camera pans to show Cielo dr and mentions Sharon Tates name i was blown away.",UCug7ktecJWXXdbWLSz-bXuw,Ugw0rxrrgS8e_mAbxYh4AaABAg,https://www.youtube.com/watch?v=ELeMaP8EPAA&lc=Ugw0rxrrgS8e_mAbxYh4AaABAg
46,,@archibaldsalyards926,"2025-01-19 01:13:50",0,no,no,"At the end of the day: if we ask the question: ""We are ALL already HasBins!!!""",UCRJy1U2xPI9yHTtzBWXXzGA,UgzvrUksWq5ZDJ49CQt4AaABAg,https://www.youtube.com/watch?v=ELeMaP8EPAA&lc=UgzvrUksWq5ZDJ49CQt4AaABAg
47,,@thebeatles8008,"2025-01-21 13:56:45",0,no,no,"Suatu ketika di Hollywood",UCobzmKeSgSVaxxTVquH_1tQ,UgxP2V-SBAP2qc50xYR4AaABAg,https://www.youtube.com/watch?v=ELeMaP8EPAA&lc=UgxP2V-SBAP2qc50xYR4AaABAg
48,,@diktisad,"2025-01-27 00:44:14",0,no,no,"Samo što su prava Shaton Tate i društvo stvarno ubijeni tako da je ovo teška sprdačina",UCpTXcSWnoutIEC7A_OYuRDA,UgzuSwN8M-SJFP6TZFZ4AaABAg,https://www.youtube.com/watch?v=ELeMaP8EPAA&lc=UgzuSwN8M-SJFP6TZFZ4AaABAg
49,,@vikr13nt,"2025-02-01 12:57:37",0,no,no,"who's here in 2025 lmao",UCIa6z_5A2sSgzoy4FVNu3-Q,Ugz0jPKNL6QDlbdk1wJ4AaABAg,https://www.youtube.com/watch?v=ELeMaP8EPAA&lc=Ugz0jPKNL6QDlbdk1wJ4AaABAg
50,,@dme1016,"2025-02-03 05:04:25",0,no,no,"That chick who got fried at the end, did a lotta screaming for someone who had ""only"" gotten tagged in the face by a can of dog food, chewed on by a pit bull, and then ran thru a window....before getting fried....",UCMd75LGa_NraW0BaOSQk4Bw,Ugw0F9pbozpEKYOiwWJ4AaABAg,https://www.youtube.com/watch?v=ELeMaP8EPAA&lc=Ugw0F9pbozpEKYOiwWJ4AaABAg
51,,@jirihozpodebrad23,"2025-02-07 03:50:33",0,no,no,"...and the most replayed seconds of this trailer is a  bunch of Baby Boomers double checking if that was really Luke Perry x'-D",UCv1KkLwtMzKmaoiB3vYB1dQ,UgxZ0XMArdqTLtO6att4AaABAg,https://www.youtube.com/watch?v=ELeMaP8EPAA&lc=UgxZ0XMArdqTLtO6att4AaABAg
52,,@user-xv5cz3gb9y,"2025-02-08 09:39:51",1,no,no,"I can't believe this was released in 2019. I'm still waiting for the Netflix miniseries. Will this ever get released? 😭",UCKnaG1cM4Nfv6k0fUHYYdnQ,Ugzhl-pDw27oIITtttR4AaABAg,https://www.youtube.com/watch?v=ELeMaP8EPAA&lc=Ugzhl-pDw27oIITtttR4AaABAg
53,,@AlbertMarasigan-ec1hj,"2025-02-09 05:52:32",0,no,no,"I love once upon a time in Hollywood and kill bill volume one and two and danjo unchained and the hateful eight and inglorious basterds.",UCEfuxIbW62c_4CzbthiywjA,UgziMxR0kBGmAF9imZN4AaABAg,https://www.youtube.com/watch?v=ELeMaP8EPAA&lc=UgziMxR0kBGmAF9imZN4AaABAg
54,,@koheletcalaforexclan6508,"2025-02-14 07:25:38",1,no,no,"I have no idea why i waited 5 years to watch this! I can’t stop watching it! I’ve watched it ten times now! 
It’s… a masterpiece! A magnificent masterpiece",UC27FgQRlvC-1MtdjfCbJqlg,Ugx5u3mPE2jVAQTK2XB4AaABAg,https://www.youtube.com/watch?v=ELeMaP8EPAA&lc=Ugx5u3mPE2jVAQTK2XB4AaABAg
55,,@m.krishna9216,"2025-02-14 07:27:12",0,no,no,"Hoping for a QUENTIN TARANTINO movie againn😫😫😫💀...",UCu9MNbVQHXTwdTIbrDI8JBg,Ugx85UIeygPKSgSydVZ4AaABAg,https://www.youtube.com/watch?v=ELeMaP8EPAA&lc=Ugx85UIeygPKSgSydVZ4AaABAg
56,,@rouge7516,"2025-02-15 19:57:45",0,no,no,"Love the 뚝배기(means heads of creatures doing DEVIL THINGS😂😂) SHOW with tomato pasted bloody mad moving scene featuring pateneted by TARANTINO. In korea we express the feelings as  i feel just have a drink the CIDER or SPRITE . 😂😂😂",UC0iMmEUFGZkHUYf2AtJOsnA,UgyQ-K9Tq4JHcUKGc2V4AaABAg,https://www.youtube.com/watch?v=ELeMaP8EPAA&lc=UgyQ-K9Tq4JHcUKGc2V4AaABAg
57,,@skipperhostile1345,"2025-02-18 01:15:26",0,no,no,"Leo's Brad & Butters in Hollywood",UCvVuoiruW8guFzOVRbmcEwQ,UgwdiqFxKbrr11y-0J94AaABAg,https://www.youtube.com/watch?v=ELeMaP8EPAA&lc=UgwdiqFxKbrr11y-0J94AaABAg
58,,@brigidvanparys2062,"2025-02-20 09:23:13",0,no,no,"I love it because they asked Sharon Tates family if it would be okay to include her part of the movie ❤",UCwLH-8NPm0B4JQ9-4Q7MbVg,UgyT6s-tEbvAIgxcpnl4AaABAg,https://www.youtube.com/watch?v=ELeMaP8EPAA&lc=UgyT6s-tEbvAIgxcpnl4AaABAg
59,,@unpopuIaropinion,"2025-02-20 10:48:18",2,no,no,"what a huge wate of time this movie was.",UC8kh-KOvy92rGi8vnzcNUDQ,UgyWpgf90FXL3Xh87Jt4AaABAg,https://www.youtube.com/watch?v=ELeMaP8EPAA&lc=UgyWpgf90FXL3Xh87Jt4AaABAg
60,,@Timicutie,"2025-02-20 16:32:33",1,no,no,"Imagine Margot Robbie Margaret Qualley Sydney Sweeney, you don't see that all day😮",UC8j4LkJvkhgUiDbP9jUZwaw,UgyaTq9lC3hbEIBwc5R4AaABAg,https://www.youtube.com/watch?v=ELeMaP8EPAA&lc=UgyaTq9lC3hbEIBwc5R4AaABAg
61,,@Bstoudt18,"2025-02-21 01:59:22",0,no,no,"May the Schwartz be with you",UCcdsZKjr3deJHXqbXGopzrA,UgzwqzM4L5vXq4ufoE54AaABAg,https://www.youtube.com/watch?v=ELeMaP8EPAA&lc=UgzwqzM4L5vXq4ufoE54AaABAg
62,,@EndritLica-m8h,"2025-02-21 08:41:47",0,no,no,MILANO,UCnuW7BLQN8L_1bPa2e50Thg,UgwiTuI-1JBEDQ6uTN14AaABAg,https://www.youtube.com/watch?v=ELeMaP8EPAA&lc=UgwiTuI-1JBEDQ6uTN14AaABAg
63,,@skylargreenlee01,"2025-02-27 05:44:15",0,no,no,"Once Upon a Time in Hollywood (2019) 
Director: Quentin Tarantino 
Filming Dates: June 18, 2018 - November 1, 2018 
Release Date: July 26, 2019 
MPAA Rating: R [Restricted] 
Runtime: 2 hr 41 min (161 min) 
Studio: Columbia Pictures (Sony)",UCgH0iMMsE_FTuAK3tylKP9A,Ugz4ARtzUnBoV6o7QId4AaABAg,https://www.youtube.com/watch?v=ELeMaP8EPAA&lc=Ugz4ARtzUnBoV6o7QId4AaABAg
64,,@czeshirecat6278,"2025-03-01 16:38:01",0,no,no,"I love Tarantino. This one turns the narrative around. Took me a couple of watches to realise what he’d done.  I wish his version had been the real one. ❤❤",UC24AaGzRhAHl6dO5IaPt62g,Ugw3akwVZr4QgFXe4ZN4AaABAg,https://www.youtube.com/watch?v=ELeMaP8EPAA&lc=Ugw3akwVZr4QgFXe4ZN4AaABAg
65,,@alifsetiawanz,"2025-03-03 13:37:17",0,no,no,"this movie is my first impression with Mikey Madison and I Luv it~",UCr1e3NMqlxUK5nw9jKjZWpA,UgxddF9wHZ3AAEk8g-p4AaABAg,https://www.youtube.com/watch?v=ELeMaP8EPAA&lc=UgxddF9wHZ3AAEk8g-p4AaABAg
66,,@emporergrimes,"2025-03-08 14:59:01",1,no,no,"Another dumb movie about actors being actors",UChRQ9ifwCHFWm_rBDUh9qXA,Ugw-W0-YtBdmMv8eggh4AaABAg,https://www.youtube.com/watch?v=ELeMaP8EPAA&lc=Ugw-W0-YtBdmMv8eggh4AaABAg
67,,@LiaSantos-,"2025-03-09 01:20:05",1,no,no,"Saw the movie this night and gosh! Wow! Its amazing! 1st movie I saw of Tarantino and I just love it! I laugh hard on the end 
That scene with the dog and the flames and Italian Girl was really funny!
I loved it!",UCXtE_R_PkXAJkeJrtRXrw_Q,Ugxh7HWhlwd1IvgLvmh4AaABAg,https://www.youtube.com/watch?v=ELeMaP8EPAA&lc=Ugxh7HWhlwd1IvgLvmh4AaABAg
68,,@EndingRetrograde,"2025-03-11 04:47:12",0,no,no,"One of my favorite films. So damn amazing",UCLUE24sdm4w34W-cIOnKPEg,Ugx8x_z-0odWiGKfFEx4AaABAg,https://www.youtube.com/watch?v=ELeMaP8EPAA&lc=Ugx8x_z-0odWiGKfFEx4AaABAg
69,,@IronWolf277,"2025-03-14 20:50:42",0,no,no,"There are Movies and there are Cinema. This is Pure Cinema, freaking love this film!",UCLYb6schSIJBuauvK3j5-Qw,UgywzT1fybtLiwdH3KF4AaABAg,https://www.youtube.com/watch?v=ELeMaP8EPAA&lc=UgywzT1fybtLiwdH3KF4AaABAg
70,,@Shiro_Kingpoet-h6u,"2025-03-14 21:18:58",0,no,no,"Looks like a sick movies still 🔥💯",UCceErZFTa-gNoX4qycPWppw,UgwFad3dN_dKrSwtbW94AaABAg,https://www.youtube.com/watch?v=ELeMaP8EPAA&lc=UgwFad3dN_dKrSwtbW94AaABAg
71,,@deckardvostok2203,"2025-03-24 02:58:51",1,no,no,"Piece a junk flick, knew it, bloody knew it!, now I know why I kept neglecting this POC movie, finished watching it last night, again another movie with a change on real events like the basterds, but this one is pathetic! at least the basterds is kinda entertaining, but this one is a complete piece of garbage, what's with all the that stupid and boring juggling to end with a lame twist of the real events that did happened?.....complete bull!....glad I did not rent it!",UCV2X4P9eCrj_Y2HQHjFTA7A,UgzFhveKhL_MVf1EijJ4AaABAg,https://www.youtube.com/watch?v=ELeMaP8EPAA&lc=UgzFhveKhL_MVf1EijJ4AaABAg
72,,@toddbrackett4277,"2025-03-30 11:00:29",1,no,no,"Great movie",UC90ROefGCCc3f5GjRoqk4cg,UgyJsTvsoxRrOnR1jHx4AaABAg,https://www.youtube.com/watch?v=ELeMaP8EPAA&lc=UgyJsTvsoxRrOnR1jHx4AaABAg
73,,@skye_belle888,"2025-04-01 11:45:25",0,no,no,"That cast 😮 I can't believe I haven't seen this yet!",UC9ytyTO8y32nH2jBNpSmMZA,UgyxqPzYPWYaF_MQRzd4AaABAg,https://www.youtube.com/watch?v=ELeMaP8EPAA&lc=UgyxqPzYPWYaF_MQRzd4AaABAg
74,,@maxaintgoneyet,"2025-04-02 20:36:43",2,no,no,"FINCHER AND TARANTINO?!?! ARE YOU KIDDING?!?!",UCtrVTBQxNtX1StNkdlc8TUg,UgznJMFVdHxZw19HduV4AaABAg,https://www.youtube.com/watch?v=ELeMaP8EPAA&lc=UgznJMFVdHxZw19HduV4AaABAg
75,,@jeff-onedayatatime.2870,"2025-04-08 17:36:31",2,no,no,"Great story, perfectly executed. (My 4 word review of Once Upon A Time In Hollywood.) :)",UChCvF_am9fwoTDIj1At84Rg,UgwREBQIPClWYSzoYTl4AaABAg,https://www.youtube.com/watch?v=ELeMaP8EPAA&lc=UgwREBQIPClWYSzoYTl4AaABAg
76,,@GrietjeAaltjeGeerts,"2025-04-12 21:15:19",1,no,no,"❤💋❤️I Love You Brad Pitt❤️💋❤️Brad Pitt houdt meer van mijn❤️💋❤️ik houdt meer van Brad Pitt❤️💋❤️",UC5t3ItQBsLNDfi00mutRcBA,UgxCt24LIudyDEUa1wp4AaABAg,https://www.youtube.com/watch?v=ELeMaP8EPAA&lc=UgxCt24LIudyDEUa1wp4AaABAg
77,,@shaksiyat,"2025-04-14 03:25:22",0,no,no,"This movie makes you wanna live in that era",UCMwaong9YpRP8vWWqXzc7Eg,UgwZp2tZcnRJ1cUK-pV4AaABAg,https://www.youtube.com/watch?v=ELeMaP8EPAA&lc=UgwZp2tZcnRJ1cUK-pV4AaABAg
78,,@MARCO_GAMING1923,"2025-04-14 04:21:05",0,no,no,"I love ti this movie",UCvM-l4Q-WPjNWI9cv2tJ7Nw,UgzMXMKnYM-o6BfjkSN4AaABAg,https://www.youtube.com/watch?v=ELeMaP8EPAA&lc=UgzMXMKnYM-o6BfjkSN4AaABAg
79,,@aadil7348,"2025-04-22 17:14:02",0,no,no,"Wow I like this movie",UCeSHAzDwvRthVXC-IBMnCUw,UgwSW_KBr6nepZl_QEd4AaABAg,https://www.youtube.com/watch?v=ELeMaP8EPAA&lc=UgwSW_KBr6nepZl_QEd4AaABAg
80,,@darrylwynwilliams1760,"2025-04-25 19:56:29",0,no,no,"01:17  ""It's official old buddy-I'm a has been""

Was that a subtle nod to Quentin Tarantino ?

He hasn't made a decent movie since Jackie Brown.",UCZ_CV4VJWVbSWjhQ-9XK3CQ,UgzlqWR7mDFVsOMh7ph4AaABAg,https://www.youtube.com/watch?v=ELeMaP8EPAA&lc=UgzlqWR7mDFVsOMh7ph4AaABAg
81,,@nr655321,"2025-04-27 18:55:48",1,no,no,"Very interesting movie. There's something uniquely comfortable about it.",UCVMgF4SVeHGhs6nQbVqCXLw,UgxgjytwL3UH8IW6rO94AaABAg,https://www.youtube.com/watch?v=ELeMaP8EPAA&lc=UgxgjytwL3UH8IW6rO94AaABAg
82,,@Arhatu,"2025-04-28 07:54:42",0,no,no,"Do people watch Tarantino movies?",UCA4MyORhuG1Ofr4QOFocZAA,UgxWzC0dn3jg4fPIGRB4AaABAg,https://www.youtube.com/watch?v=ELeMaP8EPAA&lc=UgxWzC0dn3jg4fPIGRB4AaABAg
83,,@tomc2979,"2025-04-28 23:57:28",0,no,no,"The more I watch this film, the more I realize that, without Cliff Booth, this story would be really uninteresting.",UCz4Viq7qTAcWj3k-O0qg2rw,Ugx_fvuYznQORzzYzZt4AaABAg,https://www.youtube.com/watch?v=ELeMaP8EPAA&lc=Ugx_fvuYznQORzzYzZt4AaABAg
84,,@monicafields3956,"2025-05-01 14:57:06",3,no,no,"I bet that was the best time to be alive when the world felt free  ☮️",UC1uJzSRV2tQg8qCNZRnH50g,UgxfifsTbN5NmqTkxNZ4AaABAg,https://www.youtube.com/watch?v=ELeMaP8EPAA&lc=UgxfifsTbN5NmqTkxNZ4AaABAg
85,,@Magnum44suicde,"2025-05-02 22:16:43",0,no,no,"Trailer is cooler than the movie",UCJHrL5xD7ddrqadqeIElsHA,UgxJtl33PWCXiml9kx14AaABAg,https://www.youtube.com/watch?v=ELeMaP8EPAA&lc=UgxJtl33PWCXiml9kx14AaABAg
86,,@august1763,"2025-05-08 16:35:52",1,no,no,"I thought this looked like it was gonna be a lighthearted comedy... until I heard the words ""I'm Sharon Tate.""😳💔😓 PLOT TWIST",UCUHpW7zd7IMlegXpYXG4PxA,UgxDjCDYpXkuwbKklGZ4AaABAg,https://www.youtube.com/watch?v=ELeMaP8EPAA&lc=UgxDjCDYpXkuwbKklGZ4AaABAg
87,,@FarmerFpv,"2025-05-11 01:21:54",1,no,no,"Why do I love this movie so much? I watch on every year.",UCNTpotPojPhyl5hIcf_eh0w,Ugw_WIwFzHG4Tnu6RvV4AaABAg,https://www.youtube.com/watch?v=ELeMaP8EPAA&lc=Ugw_WIwFzHG4Tnu6RvV4AaABAg
88,,@hemant7658,"2025-05-11 18:19:18",0,no,no,"What a movie!! What a movie!! WHAT AA MOVIEEE!! ❤",UClcVFW8-Acf8AGHeJLitsUg,Ugyn3qYk_g4yUhvIf3x4AaABAg,https://www.youtube.com/watch?v=ELeMaP8EPAA&lc=Ugyn3qYk_g4yUhvIf3x4AaABAg
89,,@GlocksClocked,"2025-05-12 06:43:16",0,no,no,"BULLSHIT MOVIE.

THE JOLE WHERE BRAD COULD PASS FOR LEONARDO DICAPRIO'S KID IS SO BS and doesn't land,it woulda made sense if that was Tom Cruise.

The only good part was Leo's acting where he nailed that accent!!",UCV3EbsBEzWYzR5aIF7R3QOQ,UgyBJYRGggTp6h4yNil4AaABAg,https://www.youtube.com/watch?v=ELeMaP8EPAA&lc=UgyBJYRGggTp6h4yNil4AaABAg
90,,@SignalActive-k3t,"2025-05-13 06:12:40",0,no,no,"Dos buenos amigos desde siempre. Al fin cual de los dos estuvo con valentina  en Cancun.",UC-hG2IpjjbfpoXpOmlMAylQ,UgzLDlauOw7vxe1UKeV4AaABAg,https://www.youtube.com/watch?v=ELeMaP8EPAA&lc=UgzLDlauOw7vxe1UKeV4AaABAg
91,,@Bultish,"2025-05-15 20:18:00",0,no,no,"Is it any good? 🤨",UC7e6x-9ZXKxS4wPcYdDSGfQ,UgxrSoUH7Ni3FUQIJ-Z4AaABAg,https://www.youtube.com/watch?v=ELeMaP8EPAA&lc=UgxrSoUH7Ni3FUQIJ-Z4AaABAg
92,,@mateusmenezes9925,"2025-05-18 23:01:38",2,no,no,"I LOVE THIS MOVIE!!! 😎👽☠️🌴❤",UCRpAdQFxcxG8n7Y_WhHp5FA,UgyGaF31qs_q02YYv_l4AaABAg,https://www.youtube.com/watch?v=ELeMaP8EPAA&lc=UgyGaF31qs_q02YYv_l4AaABAg
93,,@spykeso9,"2025-05-19 00:12:21",2,no,no,"This trailer does things to a man",UCPBPP9KHXO-zno6QxHuda4A,Ugz4YI12L0L1OzlZTDR4AaABAg,https://www.youtube.com/watch?v=ELeMaP8EPAA&lc=Ugz4YI12L0L1OzlZTDR4AaABAg
94,,@berlinmmm1938,"2025-05-19 19:42:06",0,no,no,"The Best Tarantino Movie No.1#",UCGY1K9vq_lqLb9pRu5cbTCg,Ugws5IYN1tgacj7hRgZ4AaABAg,https://www.youtube.com/watch?v=ELeMaP8EPAA&lc=Ugws5IYN1tgacj7hRgZ4AaABAg
