95,,@surfguy87,"2025-05-21 16:53:20",1,no,no,"For me, this is Tarantino's best work. It depicts one of the most important events in popular subculture, which is not only bold but highly ambitions from Tarantino, if only because of the amount of opinion that exists about the event. The attention to detail is a joy to behold, and for seconds you actually get a feel for the times, something very few films capture.",UCJJnICDiGjV7E5XbVwktAEg,Ugx6tvbFP07KPTaon3J4AaABAg,https://www.youtube.com/watch?v=ELeMaP8EPAA&lc=Ugx6tvbFP07KPTaon3J4AaABAg
96,,@danielelliott5532,"2025-05-23 19:40:53",0,no,no,"Sorry Margo but if you want a toe job your gonna have to wash those twinkle toes..",UCkB6CsvHbprvA3rOgD5o6ZA,UgyE-FcBIoFUyt2aKvp4AaABAg,https://www.youtube.com/watch?v=ELeMaP8EPAA&lc=UgyE-FcBIoFUyt2aKvp4AaABAg
97,,@danielelliott5532,"2025-05-23 20:57:22",0,no,no,"First tine I saw these I was propper spannered and IB  wss proper 
now no excuse,quality movies...if you dont know that time is a teacher... 
if you had to pick your favourite mivie,its just l8ke pickin your favourite dish..it aint beans on toast...,",UCkB6CsvHbprvA3rOgD5o6ZA,UgwXJzuEat2_Pz1YmdB4AaABAg,https://www.youtube.com/watch?v=ELeMaP8EPAA&lc=UgwXJzuEat2_Pz1YmdB4AaABAg
98,,@sportsentertainmentco9877,"2025-05-25 17:06:53",1,no,no,"Leos movies are better to me. Denzel has a longer resume. Hes in more great movies.  Gladiator was inmersion breaking imo. Dicaprio has better top 5 movies imo. Wolf of walstreet, titanic, the revenant, django, once upon a time in hollywood is a better top 5 line up than denzels",UCEKRPbSSOFaG6iTMqQ5Q5rw,UgyHu5aFnbXKgSeunQ94AaABAg,https://www.youtube.com/watch?v=ELeMaP8EPAA&lc=UgyHu5aFnbXKgSeunQ94AaABAg
99,,@hamdullaerbay5242,"2025-05-25 19:10:58",0,no,no,"Great 💫💫👍👍💪💪",UCSnH2tnU44nCMBFV-EKSEmw,UgzKE5OE2jKiYdxzg914AaABAg,https://www.youtube.com/watch?v=ELeMaP8EPAA&lc=UgzKE5OE2jKiYdxzg914AaABAg
100,,@gabrielhernandez9232,"2025-05-28 23:47:02",0,no,no,"Hollywood is all propaganda",UCGTDYKewRJfCxgfreqlqtSA,UgxdqrihftLxA-_xRH54AaABAg,https://www.youtube.com/watch?v=ELeMaP8EPAA&lc=UgxdqrihftLxA-_xRH54AaABAg
